<?xml version="1.0" encoding="ISO-8859-1"?>
<paramInfo xmlns:xsi="http://www.w3.org/2001/XMLSchema-instance"
           xsi:noNamespaceSchemaLocation="https://seadas.gsfc.nasa.gov/software/schemas/ParamInfo-1.0.xsd">
    <programMetaData>
        <hasParFile>false</hasParFile>
        <parFileOptionName>NO_PAR_FILE</parFileOptionName>
        <primaryOptions>
            <primaryOption>ifile</primaryOption>
            <primaryOption>ofile</primaryOption>
        </primaryOptions>
    </programMetaData>
    <options>
        <option type="ifile">
            <name>ifile</name>
            <value></value>
            <default></default>
            <description>input MODIS/VIIRS/SewWiFS L1A datafile</description>
            <source>command line</source>
            <aliases>
                <alias>ifile1</alias>
            </aliases>
            <usedAs>argument</usedAs>
            <order>0</order>
        </option>
        <option type="int">
            <name>West (SWlon)</name>
            <value></value>
            <default></default>
            <description>Southwest longitude</description>
            <order>1</order>
<!--            <source>lonlat2pixline</source>-->
            <usedAs>option</usedAs>
        </option>
        <option type="int">
            <name>South (SWlat)</name>
            <value></value>
            <default></default>
            <description>Southwest latitude</description>
            <order>2</order>
<!--            <source>lonlat2pixline</source>-->
            <usedAs>option</usedAs>
        </option>
        <option type="int">
            <name>East (NElon)</name>
            <value></value>
            <default></default>
            <description>Northesat longitude</description>
            <order>3</order>
<!--            <source>lonlat2pixline</source>-->
            <usedAs>option</usedAs>
        </option>
        <option type="int">
            <name>North (NElat)</name>
            <value></value>
            <default></default>
            <description>Northeast latitude</description>
            <order>4</order>
<!--            <source>lonlat2pixline</source>-->
            <usedAs>option</usedAs>
        </option>
        <option type="ofile">
            <name>ofile</name>
            <value></value>
            <default>output</default>
            <description>output extracted file name</description>
            <usedAs>argument</usedAs>
            <order>5</order>
        </option>
    </options>
</paramInfo>
