<?xml version="1.0" encoding="ISO-8859-1"?>
<paramInfo xmlns:xsi="http://www.w3.org/2001/XMLSchema-instance"
            xsi:noNamespaceSchemaLocation="https://seadas.gsfc.nasa.gov/software/schemas/ParamInfo-1.0.xsd">
    <programMetaData>
        <hasParFile>true</hasParFile>
        <parFileOptionName>par</parFileOptionName>
        <!--krow:   810 out of   2160  (-22.50 to   0.00) Tue Jun 26 16:14:55 2012-->
        <progressRegex>krow: +(\d+) out of +(\d+)</progressRegex>
        <primaryOptions>
            <primaryOption>ifile</primaryOption>
            <primaryOption>ofile</primaryOption>
        </primaryOptions>
    </programMetaData>
    <options>
        <option type="help">
            <name>-help</name>
            <value>false</value>
            <default>false</default>
            <source>default</source>
            <aliases>
                <alias>-h</alias>
                <alias>--help</alias>
            </aliases>
            <description>print usage information</description>
        </option>
        <option type="help">
            <name>-version</name>
            <value>false</value>
            <default>false</default>
            <source>default</source>
            <aliases>
                <alias>--version</alias>
            </aliases>
            <description>print the version information</description>
        </option>
        <option type="help">
            <name>-dump_options</name>
            <value>false</value>
            <default>false</default>
            <source>default</source>
            <aliases>
                <alias>--dump_options</alias>
            </aliases>
            <description>print information about each option</description>
        </option>
        <option type="help">
            <name>-dump_options_paramfile</name>
            <value>l3bindump_options.txt</value>
            <source>default</source>
            <aliases>
                <alias>--dump_options_paramfile</alias>
            </aliases>
            <description>print information about each option to paramfile</description>
        </option>
        <option type="help">
            <name>-dump_options_xmlfile</name>
            <value>l3bindump_options.xml</value>
            <source>command line</source>
            <aliases>
                <alias>--dump_options_xmlfile</alias>
            </aliases>
            <description>print information about each option to XML file</description>
        </option>
        <option type="help">
            <name>par</name>
            <value/>
            <source>default</source>
            <description>input parameter file</description>
        </option>
        <option type="ifile">
            <name>ifile</name>
            <value></value>
            <source>command line</source>
            <description>input L3 file name</description>
        </option>
        <option type="ofile">
            <name>ofile</name>
            <value>output.txt</value>
            <source>default</source>
            <description>input L3 file name</description>
        </option>
        <option type="string">
            <name>oformat</name>
            <value>txt</value>
            <default>txt</default>
            <source>default</source>
            <validValues>
                <validValue>
                    <value>txt</value>
                    <description>plain text columnar format</description>
                </validValue>
                <validValue>
                    <value>seabass</value>
                    <description>SeaBASS format</description>
                </validValue>
            </validValues>
            <description>output file format</description>
        </option>
        <option type="string">
            <name>l3bprod</name>
            <value></value>
            <default></default>
            <source>default</source>
            <description>binned product to extract</description>
        </option>
        <option type="int">
            <name>bin_number</name>
            <value></value>
            <default></default>
            <source>default</source>
            <description>bin number</description>
        </option>
        <option type="float">
            <name>north</name>
            <value></value>
            <default></default>
            <source>default</source>
            <description>north boundary</description>
        </option>
        <option type="float">
            <name>south</name>
            <value></value>
            <default></default>
            <source>default</source>
            <description>south boundary</description>
        </option>
        <option type="float">
            <name>east</name>
            <value></value>
            <default></default>
            <source>default</source>
            <description>east boundary</description>
        </option>
        <option type="float">
            <name>west</name>
            <value></value>
            <default></default>
            <source>default</source>
            <description>west boundary</description>
        </option>
        <option type="float">
            <name>lat</name>
            <value></value>
            <default></default>
            <source>default</source>
            <description>latitude</description>
        </option>
        <option type="float">
            <name>lon</name>
            <value></value>
            <default></default>
            <source>default</source>
            <description>longitude</description>
        </option>
        <option type="float">
            <name>radius</name>
            <value></value>
            <default></default>
            <source>default</source>
            <description>radius</description>
        </option>
        <option type="boolean">
            <name>verbose</name>
            <value></value>
            <default></default>
            <source>default</source>
            <description>verbose output</description>
        </option>
    </options>
</paramInfo>
